{
  "name": "support",
  "kind": "product",
  "description": "The support agent; being entitled is the switch (spec 017 FR-001)",
  "dependencies": [
    {
      "module": "core",
      "range": ">=0.3.0 <1.0.0"
    }
  ],
  "services": [
    {
      "name": "support-agent",
      "descriptor": {
        "image": "europe-west1-docker.pkg.dev/eitheror/casino/support-agent:0.0.0",
        "expose": true,
        "runtime": "0.13.0",
        "env": [
          {
            "name": "CASINO_PROJECT",
            "key": "casino-project"
          },
          {
            "name": "CASINO_BRAND",
            "key": "casino-brand"
          },
          {
            "name": "CASINO_REAL_MONEY",
            "key": "casino-real-money"
          },
          {
            "name": "ANKKA_AUTH_ISSUERS",
            "value": "player,staff"
          },
          {
            "name": "ANKKA_AUTH_REALM",
            "key": "auth-realm"
          },
          {
            "name": "ANKKA_AUTH_PLAYER_ISSUER",
            "key": "auth-player-issuer"
          },
          {
            "name": "ANKKA_AUTH_PLAYER_JWKS_URL",
            "key": "auth-player-jwks-url"
          },
          {
            "name": "ANKKA_AUTH_PLAYER_AUDIENCE",
            "key": "auth-player-audience"
          },
          {
            "name": "ANKKA_AUTH_STAFF_ISSUER",
            "key": "auth-staff-issuer"
          },
          {
            "name": "ANKKA_AUTH_STAFF_JWKS_URL",
            "key": "auth-staff-jwks-url"
          },
          {
            "name": "ANKKA_AUTH_STAFF_AUDIENCE",
            "value": "eitheror-casino"
          },
          {
            "name": "PLAYER_SITE_BASE",
            "key": "player-site-base"
          },
          {
            "name": "KEYCLOAK_ISSUER_BASE",
            "key": "keycloak-issuer-base"
          },
          {
            "name": "KEYCLOAK_JWKS_BASE",
            "key": "keycloak-jwks-base"
          },
          {
            "name": "MODEL_PROVIDER_KEY",
            "key": "model-provider-key"
          }
        ]
      }
    }
  ],
  "configuration": [
    {
      "key": "casino-project",
      "type": "string",
      "secret": false
    },
    {
      "key": "casino-brand",
      "type": "string",
      "secret": false
    },
    {
      "key": "casino-real-money",
      "type": "boolean",
      "secret": false
    },
    {
      "key": "auth-realm",
      "type": "string",
      "secret": false
    },
    {
      "key": "auth-player-issuer",
      "type": "url",
      "secret": false
    },
    {
      "key": "auth-player-jwks-url",
      "type": "url",
      "secret": false
    },
    {
      "key": "auth-player-audience",
      "type": "string",
      "secret": false
    },
    {
      "key": "auth-staff-issuer",
      "type": "url",
      "secret": false
    },
    {
      "key": "auth-staff-jwks-url",
      "type": "url",
      "secret": false
    },
    {
      "key": "player-site-base",
      "type": "url",
      "secret": false
    },
    {
      "key": "keycloak-issuer-base",
      "type": "url",
      "secret": false
    },
    {
      "key": "keycloak-jwks-base",
      "type": "url",
      "secret": false
    },
    {
      "key": "model-provider-key",
      "type": "string",
      "secret": true
    }
  ],
  "retention": "7d"
}
